{
  "schema_version": "1.0.0",
  "document_id": "18216-05",
  "retrieval_cutoff": "2026-08-07T13:00:00Z",
  "coverage": {
    "universe": "Intervenciones municipales sustantivas identificadas en las fuentes curadas y archivadas para este dossier.",
    "method": "Se indexa a toda alcaldesa o alcalde que aparece con una posición, gestión o cifra atribuida sobre la reforma. Una mención protocolar sin intervención se conserva en la fuente, pero no se transforma artificialmente en perfil.",
    "municipal_sources_curated": 22,
    "actors_indexed": 17,
    "blind_path_rule": "Estos antecedentes se cargan sólo después del veredicto ciego y no pueden ser entrada de evaluación.",
    "limitation": "Es exhaustivo respecto del corpus curado hasta el corte, no respecto de internet: toda fuente inaccesible queda declarada como brecha y puede ampliar el universo en una nueva corrida offline."
  },
  "actors": [
    {
      "id": "gustavo-alessandri",
      "name": "Gustavo Alessandri",
      "municipality": "Zapallar",
      "role": "Alcalde y presidente de la AChM",
      "affiliation": "RN",
      "position_group": "government_formula",
      "position_summary": "Respaldó la fórmula negociada de compensación total, después de exigir que ningún municipio perdiera ingresos.",
      "public_record": [{
        "date": "2026-07-16",
        "action": "Respaldó el acuerdo con Hacienda que ofrecía compensar íntegramente la menor recaudación municipal por contribuciones.",
        "outcome": "La compensación total fue aprobada en comisión mixta; el efecto presupuestario efectivo aún no puede observarse.",
        "assessment": "Su exigencia nominal de no reducir ingresos quedó recogida, pero sigue pendiente medir distribución, oportunidad y condiciones de la compensación.",
        "status": "pending",
        "source_ids": ["achm-directors-statement", "achm-total-compensation", "biobio-opposition-mayors", "cooperativa-mixed-commission"]
      }],
      "source_ids": ["achm-directors-statement", "achm-dialogue-july", "achm-total-compensation", "biobio-opposition-mayors"],
      "record_caveat": "La posición y el resultado se presentan como hechos públicos; no son una nota de credibilidad ni prueban que una afirmación posterior sea verdadera."
    },
    {
      "id": "tomas-vodanovic",
      "name": "Tomás Vodanovic",
      "municipality": "Maipú",
      "role": "Alcalde",
      "affiliation": "Frente Amplio",
      "position_group": "targeted_exemption",
      "position_summary": "Pidió focalizar la exención y llevar la compensación al Fondo Común Municipal para evitar una distribución regresiva.",
      "public_record": [{
        "date": "2026-07-02",
        "action": "Presentó con otros alcaldes una alternativa de exención focalizada y compensación redistributiva a través del Fondo Común Municipal.",
        "outcome": "La fórmula final mantuvo una exención amplia y compensación total, sin adoptar íntegramente su alternativa distributiva.",
        "assessment": "Se puede contrastar el diseño aprobado con su propuesta; el efecto distributivo real permanece pendiente de ejecución presupuestaria.",
        "status": "observed",
        "source_ids": ["emol-mayors-hacienda-july", "theclinic-mayors-focalization", "cnn-opposition-mayors-letter"]
      }],
      "source_ids": ["emol-mayors-hacienda-july", "theclinic-mayors-focalization", "biobio-opposition-mayors", "cnn-opposition-mayors-letter"],
      "record_caveat": "La comparación registra qué diseño defendió y cuál avanzó; no atribuye intención ni convierte su trayectoria en evidencia de una afirmación."
    },
    {
      "id": "karina-delfino",
      "name": "Karina Delfino",
      "municipality": "Quinta Normal",
      "role": "Alcaldesa y vicepresidenta de la AChM",
      "affiliation": "PS",
      "position_group": "targeted_exemption",
      "position_summary": "Defendió una exención focalizada y una compensación que preservara el carácter solidario del Fondo Común Municipal.",
      "public_record": [{
        "date": "2026-07-23",
        "action": "Cuestionó con ejemplos comunales que la compensación propuesta reprodujera la distribución previa de ingresos por contribuciones.",
        "outcome": "El Congreso aprobó una compensación total; la incidencia distributiva entre comunas queda pendiente de datos de ejecución.",
        "assessment": "La compensación nominal responde a la pérdida agregada, pero no resuelve por sí sola su objeción distinta sobre distribución territorial.",
        "status": "pending",
        "source_ids": ["emol-quiroz-mayor-response", "cooperativa-mixed-commission"]
      }],
      "source_ids": ["achm-directors-statement", "eldinamo-municipal-front", "emol-mayors-hacienda-july", "emol-quiroz-mayor-response", "cnn-opposition-mayors-letter"],
      "record_caveat": "La ficha distingue compensación agregada de distribución entre comunas y no usa la afiliación política como señal de veracidad."
    },
    {
      "id": "javiera-reyes",
      "name": "Javiera Reyes",
      "municipality": "Lo Espejo",
      "role": "Alcaldesa",
      "affiliation": "PC",
      "position_group": "targeted_exemption",
      "position_summary": "Rechazó el acuerdo municipal por considerarlo no representativo y sostuvo que la fórmula podía profundizar desigualdades comunales.",
      "public_record": [{
        "date": "2026-07-29",
        "action": "Suscribió la carta de alcaldes que pidió revisar la fórmula compensatoria por sus efectos distributivos entre municipios.",
        "outcome": "La fórmula avanzó pese a la objeción; sus consecuencias por comuna todavía no están observadas.",
        "assessment": "La discrepancia legislativa está documentada; comprobar su pronóstico requiere ejecución y datos municipales comparables.",
        "status": "pending",
        "source_ids": ["biobio-opposition-mayors", "cnn-opposition-mayors-letter"]
      }],
      "source_ids": ["biobio-opposition-mayors", "cnn-opposition-mayors-letter", "24horas-opposition-mayors-letter"],
      "record_caveat": "Una crítica distributiva es una hipótesis comprobable con datos posteriores, no una conclusión derivada del partido o de la comuna de quien habla."
    },
    {
      "id": "jaime-bellolio",
      "name": "Jaime Bellolio",
      "municipality": "Providencia",
      "role": "Alcalde",
      "affiliation": "UDI",
      "position_group": "revenue_protection",
      "position_summary": "Advirtió una caída relevante de ingresos propios de Providencia y exigió certeza sobre el mecanismo compensatorio.",
      "public_record": [{
        "date": "2026-05-26",
        "action": "Estimó en torno a $18 mil millones el ingreso municipal comprometido y alertó sobre servicios financiados con esos recursos.",
        "outcome": "La fórmula legislativa prometió compensación total, pero el monto y calendario efectivos aún deben verificarse.",
        "assessment": "La aprobación atendió el riesgo nominal; la exactitud de la cifra y la suficiencia operativa sólo se cierran con presupuestos ejecutados.",
        "status": "pending",
        "source_ids": ["eldinamo-municipal-front", "emol-twelve-municipalities"]
      }],
      "source_ids": ["eldinamo-municipal-front", "emol-twelve-municipalities", "eldinamo-twelve-municipalities"],
      "record_caveat": "La estimación se conserva con su fuente y estado; no se presenta como resultado observado ni como medida de desempeño personal."
    },
    {
      "id": "felipe-alessandri",
      "name": "Felipe Alessandri",
      "municipality": "Lo Barnechea",
      "role": "Alcalde",
      "affiliation": "RN",
      "position_group": "revenue_protection",
      "position_summary": "Advirtió que la exención podía restar cerca de $7 mil millones a su municipio y afectar programas locales.",
      "public_record": [{
        "date": "2026-05-26",
        "action": "Cuantificó la pérdida proyectada para Lo Barnechea y pidió resguardar financiamiento de servicios municipales.",
        "outcome": "Se aprobó una promesa de compensación total; el flujo efectivo hacia el municipio no está disponible al corte.",
        "assessment": "Su riesgo fiscal fue reconocido por el diseño compensatorio, sin que exista aún evidencia para validar el monto proyectado.",
        "status": "pending",
        "source_ids": ["eldinamo-municipal-front", "emol-twelve-municipalities"]
      }],
      "source_ids": ["eldinamo-municipal-front", "emol-twelve-municipalities", "eldinamo-twelve-municipalities"],
      "record_caveat": "Las cifras prospectivas se mantienen como proyecciones hasta contar con ejecución; el perfil no altera el análisis de sus dichos."
    },
    {
      "id": "matias-toledo",
      "name": "Matías Toledo",
      "municipality": "Puente Alto",
      "role": "Alcalde",
      "affiliation": "Independiente",
      "position_group": "targeted_exemption",
      "position_summary": "Cuestionó que la presidencia de la AChM respaldara la reforma sin representar la diversidad de posiciones municipales.",
      "public_record": [{
        "date": "2026-06-15",
        "action": "Participó en la declaración de alcaldes que pidió una postura institucional centrada en recursos y servicios locales.",
        "outcome": "La AChM continuó dividida y surgieron cartas municipales contrapuestas antes de la aprobación final.",
        "assessment": "El quiebre representativo que describió quedó observado; la consecuencia fiscal de fondo sigue pendiente.",
        "status": "observed",
        "source_ids": ["theclinic-mayor-split-june", "cnn-mayor-counterletters"]
      }],
      "source_ids": ["theclinic-mayor-split-june", "cnn-mayor-counterletters"],
      "record_caveat": "Se registra una acción pública y su desenlace institucional, no una inferencia sobre confiabilidad o motivación."
    },
    {
      "id": "paulina-bobadilla",
      "name": "Paulina Bobadilla",
      "municipality": "Quilicura",
      "role": "Alcaldesa",
      "affiliation": "Independiente",